{
  "version": "0.10",
  "generated_at": "2026-08-06T00:00:00Z",
  "review_date": "2026-08-06",
  "geographies": [
    {"geography_id": "GEO-WORLD", "name": "World", "level": "global", "parent_geography_id": null, "country_ids": [], "thailand_relationship": "indirect_context", "known_limitations": ["Global aggregates cannot establish Thailand-specific relevance on their own."]},
    {"geography_id": "GEO-RGN-SEASIA", "name": "Southeast Asia", "level": "region", "parent_geography_id": "GEO-WORLD", "country_ids": ["TH", "SG", "MY", "VN", "ID", "PH", "KH", "MM", "LA"], "thailand_relationship": "is_thailand", "known_limitations": []},
    {"geography_id": "GEO-RGN-EASIA", "name": "East Asia", "level": "region", "parent_geography_id": "GEO-WORLD", "country_ids": ["CN", "HK", "TW", "JP", "KR"], "thailand_relationship": "direct_trade_partner", "known_limitations": []},
    {"geography_id": "GEO-RGN-SASIA", "name": "South Asia", "level": "region", "parent_geography_id": "GEO-WORLD", "country_ids": ["IN", "BD", "LK", "PK"], "thailand_relationship": "direct_trade_partner", "known_limitations": []},
    {"geography_id": "GEO-RGN-MEGULF", "name": "Middle East and Gulf", "level": "region", "parent_geography_id": "GEO-WORLD", "country_ids": ["AE", "SA", "QA", "OM", "KW"], "thailand_relationship": "direct_trade_partner", "known_limitations": []},
    {"geography_id": "GEO-RGN-NEUR", "name": "Northern Europe", "level": "region", "parent_geography_id": "GEO-WORLD", "country_ids": ["NL", "DE", "BE", "GB", "FR", "PL"], "thailand_relationship": "direct_trade_partner", "known_limitations": []},
    {"geography_id": "GEO-RGN-MED", "name": "Mediterranean", "level": "region", "parent_geography_id": "GEO-WORLD", "country_ids": ["IT", "ES", "GR", "TR", "EG"], "thailand_relationship": "direct_trade_partner", "known_limitations": []},
    {"geography_id": "GEO-RGN-NAMWC", "name": "North America West Coast", "level": "region", "parent_geography_id": "GEO-WORLD", "country_ids": ["US", "CA"], "thailand_relationship": "direct_trade_partner", "known_limitations": ["Coast-level grouping; the platform holds no sub-national administrative geography for North America."]},
    {"geography_id": "GEO-RGN-NAMEC", "name": "North America East and Gulf Coast", "level": "region", "parent_geography_id": "GEO-WORLD", "country_ids": ["US", "CA"], "thailand_relationship": "direct_trade_partner", "known_limitations": ["Coast-level grouping; the platform holds no sub-national administrative geography for North America."]},
    {"geography_id": "GEO-RGN-OCEANIA", "name": "Australia and New Zealand", "level": "region", "parent_geography_id": "GEO-WORLD", "country_ids": ["AU", "NZ"], "thailand_relationship": "direct_trade_partner", "known_limitations": []},
    {"geography_id": "GEO-CTY-TH", "name": "Thailand", "level": "country", "parent_geography_id": "GEO-RGN-SEASIA", "country_ids": ["TH"], "thailand_relationship": "is_thailand", "known_limitations": []},
    {"geography_id": "GEO-CTY-CN", "name": "China", "level": "country", "parent_geography_id": "GEO-RGN-EASIA", "country_ids": ["CN"], "thailand_relationship": "direct_trade_partner", "known_limitations": []},
    {"geography_id": "GEO-CTY-JP", "name": "Japan", "level": "country", "parent_geography_id": "GEO-RGN-EASIA", "country_ids": ["JP"], "thailand_relationship": "direct_trade_partner", "known_limitations": []},
    {"geography_id": "GEO-CTY-KR", "name": "Republic of Korea", "level": "country", "parent_geography_id": "GEO-RGN-EASIA", "country_ids": ["KR"], "thailand_relationship": "direct_trade_partner", "known_limitations": []},
    {"geography_id": "GEO-CTY-SG", "name": "Singapore", "level": "country", "parent_geography_id": "GEO-RGN-SEASIA", "country_ids": ["SG"], "thailand_relationship": "transit_or_chokepoint", "known_limitations": []},
    {"geography_id": "GEO-CTY-MY", "name": "Malaysia", "level": "country", "parent_geography_id": "GEO-RGN-SEASIA", "country_ids": ["MY"], "thailand_relationship": "transit_or_chokepoint", "known_limitations": []},
    {"geography_id": "GEO-CTY-IN", "name": "India", "level": "country", "parent_geography_id": "GEO-RGN-SASIA", "country_ids": ["IN"], "thailand_relationship": "direct_trade_partner", "known_limitations": []},
    {"geography_id": "GEO-CTY-AE", "name": "United Arab Emirates", "level": "country", "parent_geography_id": "GEO-RGN-MEGULF", "country_ids": ["AE"], "thailand_relationship": "direct_trade_partner", "known_limitations": []},
    {"geography_id": "GEO-CTY-NL", "name": "Netherlands", "level": "country", "parent_geography_id": "GEO-RGN-NEUR", "country_ids": ["NL"], "thailand_relationship": "direct_trade_partner", "known_limitations": []},
    {"geography_id": "GEO-CTY-DE", "name": "Germany", "level": "country", "parent_geography_id": "GEO-RGN-NEUR", "country_ids": ["DE"], "thailand_relationship": "direct_trade_partner", "known_limitations": []},
    {"geography_id": "GEO-CTY-EG", "name": "Egypt", "level": "country", "parent_geography_id": "GEO-RGN-MED", "country_ids": ["EG"], "thailand_relationship": "transit_or_chokepoint", "known_limitations": []},
    {"geography_id": "GEO-CTY-US", "name": "United States", "level": "country", "parent_geography_id": "GEO-RGN-NAMWC", "country_ids": ["US"], "thailand_relationship": "direct_trade_partner", "known_limitations": ["Assigned to the West Coast region for hierarchy purposes only; United States nodes appear in both coast regions."]},
    {"geography_id": "GEO-CTY-PA", "name": "Panama", "level": "country", "parent_geography_id": "GEO-WORLD", "country_ids": ["PA"], "thailand_relationship": "transit_or_chokepoint", "known_limitations": []},
    {"geography_id": "GEO-CTY-AU", "name": "Australia", "level": "country", "parent_geography_id": "GEO-RGN-OCEANIA", "country_ids": ["AU"], "thailand_relationship": "direct_trade_partner", "known_limitations": []},
    {"geography_id": "GEO-WTR-MALACCA", "name": "Strait of Malacca", "level": "waterway", "parent_geography_id": "GEO-RGN-SEASIA", "country_ids": ["MY", "ID", "SG"], "thailand_relationship": "transit_or_chokepoint", "known_limitations": []},
    {"geography_id": "GEO-WTR-SINGAPORE", "name": "Singapore Strait", "level": "waterway", "parent_geography_id": "GEO-RGN-SEASIA", "country_ids": ["SG", "MY", "ID"], "thailand_relationship": "transit_or_chokepoint", "known_limitations": []},
    {"geography_id": "GEO-WTR-SUEZ", "name": "Suez Canal", "level": "waterway", "parent_geography_id": "GEO-RGN-MED", "country_ids": ["EG"], "thailand_relationship": "transit_or_chokepoint", "known_limitations": []},
    {"geography_id": "GEO-WTR-BABELMANDEB", "name": "Bab el-Mandeb Strait", "level": "waterway", "parent_geography_id": "GEO-RGN-MEGULF", "country_ids": ["YE", "DJ"], "thailand_relationship": "transit_or_chokepoint", "known_limitations": []},
    {"geography_id": "GEO-WTR-HORMUZ", "name": "Strait of Hormuz", "level": "waterway", "parent_geography_id": "GEO-RGN-MEGULF", "country_ids": ["IR", "OM", "AE"], "thailand_relationship": "transit_or_chokepoint", "known_limitations": []},
    {"geography_id": "GEO-WTR-PANAMA", "name": "Panama Canal", "level": "waterway", "parent_geography_id": "GEO-CTY-PA", "country_ids": ["PA"], "thailand_relationship": "transit_or_chokepoint", "known_limitations": []},
    {"geography_id": "GEO-WTR-TAIWAN", "name": "Taiwan Strait", "level": "waterway", "parent_geography_id": "GEO-RGN-EASIA", "country_ids": ["CN", "TW"], "thailand_relationship": "transit_or_chokepoint", "known_limitations": []},
    {"geography_id": "GEO-WTR-SUNDA", "name": "Sunda Strait", "level": "waterway", "parent_geography_id": "GEO-RGN-SEASIA", "country_ids": ["ID"], "thailand_relationship": "transit_or_chokepoint", "known_limitations": []},
    {"geography_id": "GEO-WTR-LOMBOK", "name": "Lombok Strait", "level": "waterway", "parent_geography_id": "GEO-RGN-SEASIA", "country_ids": ["ID"], "thailand_relationship": "transit_or_chokepoint", "known_limitations": []},
    {"geography_id": "GEO-ADM-TH-SONGKHLA", "name": "Songkhla Province", "level": "administrative_area", "parent_geography_id": "GEO-CTY-TH", "country_ids": ["TH"], "thailand_relationship": "is_thailand", "known_limitations": []},
    {"geography_id": "GEO-CTY-KH", "name": "Cambodia", "level": "country", "parent_geography_id": "GEO-RGN-SEASIA", "country_ids": ["KH"], "thailand_relationship": "direct_trade_partner", "known_limitations": ["Registered under WO-041 to anchor LANE-ROAD-TH-KH; the platform holds no province-level Cambodian geography."]},
    {"geography_id": "GEO-CTY-LA", "name": "Lao PDR", "level": "country", "parent_geography_id": "GEO-RGN-SEASIA", "country_ids": ["LA"], "thailand_relationship": "direct_trade_partner", "known_limitations": ["Registered under WO-041 to anchor LANE-ROAD-TH-LA and LANE-RAIL-TH-LA; the platform holds no province-level Lao geography."]},
    {"geography_id": "GEO-CTY-MM", "name": "Myanmar", "level": "country", "parent_geography_id": "GEO-RGN-SEASIA", "country_ids": ["MM"], "thailand_relationship": "direct_trade_partner", "known_limitations": ["Registered under WO-041 to anchor LANE-ROAD-TH-MM; the platform holds no province-level Myanmar geography."]}
  ],
  "countries": [
    {"country_id": "TH", "name": "Thailand", "iso3": "THA", "region_geography_id": "GEO-RGN-SEASIA", "thailand_relationship": "is_thailand", "thailand_relevance_basis": ["Thailand is the platform's primary analytical viewpoint."], "known_limitations": []},
    {"country_id": "CN", "name": "China", "iso3": "CHN", "region_geography_id": "GEO-RGN-EASIA", "thailand_relationship": "direct_trade_partner", "thailand_relevance_basis": ["Principal East Asian ocean trade partner for Thailand import and export container flows."], "known_limitations": ["Quantitative trade ranking was not retrieved under WO-010; see docs/ocean_lane_selection.md."]},